id,military_phrase,civilian_phrase,branch,category,context_notes,created_at
b14a97d4-eaec-49a4-b5db-4e091d29228a,span of control,number of direct reports / management scope,general,leadership,,2026-02-18 01:13:54.18454+00
b182dbd5-66bf-49eb-9326-7d9170b70484,Class VIII supplies,medical supplies and equipment,general,Equipment,,2026-02-18 14:03:12.64537+00
b19b2a88-9065-42fe-b242-82dc82967568,hoseman,fire suppression support operator,navy,operations,,2026-02-15 17:48:35.249974+00
b1b8211f-8949-4633-b67a-98e6b0805bfa,counseling chit,performance counseling documentation,navy,Admin,,2026-02-18 14:03:12.64537+00
b249447a-b941-4166-9ed4-20fafad89bab,guidance from above,direction from senior management,general,Communication,,2026-02-18 14:03:12.64537+00
b2f64f97-9375-44e8-8249-3d5d51ec160d,electrical safety program,electrical hazard prevention program,general,Safety,,2026-02-18 14:03:12.64537+00
b2fc93d9-4110-41d1-8f41-c44baae8d16e,served as NCOIC,served as senior noncommissioned supervisor,army,leadership,,2026-02-15 17:48:35.249974+00
b3016051-e900-4a68-ac3d-e9bda96899c2,PHA,periodic health assessment,general,Medical,,2026-02-18 14:03:12.64537+00
b3110289-7a9b-4ecd-b417-ccaba946b499,served as command sergeant major,served as senior enlisted executive advisor,army,leadership,,2026-02-15 17:48:35.249974+00
b3aa0eb8-3dd1-431d-9dab-d647d55d0413,maintained good order and discipline,maintained workplace standards and professional conduct,general,leadership,,2026-02-15 17:48:35.249974+00
b3b5c81d-8ee9-400a-bdfc-f4ef0722bbc2,dental readiness,dental health compliance status,general,Medical,,2026-02-18 14:03:12.64537+00
b470e9dc-3cb7-4ec9-a6ec-ea16254b8363,served as LPO,served as front-line team lead,navy,leadership,,2026-02-15 17:47:32.616746+00
b4a88385-cc2c-43b5-9a7f-8767ab27fe02,served as division officer,served as department manager,navy,leadership,,2026-02-15 17:47:32.616746+00
b4e5639a-5948-4347-94b1-a2d122e4d852,supported real-world operations,supported live operational missions,general,operations,,2026-02-15 17:48:35.249974+00
b527d270-ef7e-4e35-8119-2b9604e7d8b6,spot checks,quality assurance inspections,general,technical,,2026-02-15 17:47:32.616746+00
b52b7991-e702-4607-99d1-cda7e507f65f,maintained TS/SCI clearance,holds active Top Secret/SCI security clearance,general,security,,2026-02-15 17:47:32.616746+00
b53e9695-6406-4212-a3df-bc9f8998491d,decisive leadership,confident and timely decision-making,general,leadership,,2026-02-18 01:13:54.18454+00
b55e5079-37ba-49a9-843e-0fb032ac25f3,no safety violations,zero OSHA/safety violations,general,performance,,2026-02-15 17:47:32.616746+00
b5b331ba-d99b-4632-aaaf-6d0763738cb4,led from the front,led by example,general,Leadership,,2026-02-18 14:03:12.64537+00
b5dbe066-3aeb-4125-a3be-b61417ed79fa,responsible for the welfare of,accountable for the well-being of,general,Leadership,,2026-02-18 14:03:12.64537+00
b615cfbb-c70e-42cd-9951-a0d1608ae6f5,REDCON level,readiness condition level,army,Operations,,2026-02-18 14:03:12.64537+00
b65fdf3f-675f-4e39-91b2-2ff6840367ce,lesson plan author,authored instructional materials and course content,general,Training,,2026-02-18 14:03:12.64537+00
b715212d-4b00-447b-ba7b-33e59f4b4b6f,curriculum developer,designed and developed training materials,general,Training,,2026-02-18 14:03:12.64537+00
b726eb64-4423-4f3b-ac5c-64d6d36677f3,number one of all peers,top-ranked employee among all peers,general,Performance,,2026-02-18 14:03:12.64537+00
b737990b-6f59-4b73-93b9-d52f98d04c82,change of command,leadership transition / management changeover,general,admin,,2026-02-18 01:13:54.18454+00
b76a4a18-47d3-421b-a978-e44a6d502c19,PQS qualified in,professionally qualified and certified in,navy,training,,2026-02-15 17:48:35.249974+00
b7b8335f-68da-46f9-801c-a2c49da435d8,PACOM AOR,Pacific region of operations,general,Operations,,2026-02-18 14:03:12.64537+00
b81460f8-5ff6-4d0c-a5a0-1aa44147ae88,passed inspection,achieved full compliance during audit,general,compliance,,2026-02-15 17:47:32.616746+00
b8434217-e56d-4059-9049-b7c11288ff86,cyber hygiene,cybersecurity best practices / security awareness,general,cyber,,2026-02-18 01:13:54.18454+00
b85934bc-8438-480b-ac2d-9adc9c0901df,served in combat zone,served in high-risk operational environment,general,operations,,2026-02-15 17:48:35.249974+00
b866806f-acdd-4a3b-add8-5e608dd270c8,DRMO turn-in,coordinated surplus property disposal,general,logistics,,2026-02-15 17:47:32.616746+00
b91eb6c4-6460-42fa-a1b7-a445e9617769,administrative separation,involuntary termination / administrative discharge,general,admin,,2026-02-18 01:13:54.18454+00
b9573071-25bd-46ef-a01d-d54d1b64a3d2,earned air warfare designation,earned aviation operations warfare qualification,navy,training,,2026-02-15 17:48:35.249974+00
b9693b4d-f9f5-4285-8f17-b7a6d282eeeb,spot check,unannounced compliance inspection,general,Safety,,2026-02-18 14:03:12.64537+00
b969bbba-07cc-49ee-8c92-df6312174372,served on command triad,served on executive leadership team,navy,leadership,,2026-02-15 17:48:35.249974+00
b9c0438f-fa53-4e28-9486-2f8babbd651e,served as squad leader,served as team supervisor for 9-13 personnel,army,leadership,,2026-02-15 17:48:35.249974+00
b9eb5379-52e3-4c1c-a198-8e775ef39825,task organized,restructured teams for specific objectives,general,leadership,,2026-02-18 01:13:54.18454+00
b9f624a0-2ed3-4b44-9cf5-604778a14756,pass the word,disseminate information,navy,Communication,,2026-02-18 14:03:12.64537+00
b9f83e67-dbfc-4c3c-b473-7d47ae2667ea,tireless work ethic,consistently high-performing,general,Leadership,,2026-02-18 14:03:12.64537+00
ba4f1414-e0b2-4d51-82e7-493ae72fab6e,IDP on file,individual development plan documented,general,Training,,2026-02-18 14:03:12.64537+00
ba708063-c376-4663-bc00-4466b6199adf,deckplate leader,hands-on frontline leader,navy,leadership,,2026-02-17 04:35:18.795826+00
ba759439-c7f3-4968-b324-47a987e26a34,unity of effort,coordinated teamwork / aligned objectives,general,leadership,,2026-02-18 01:13:54.18454+00
bac1dd1f-56f9-4ea9-8efe-6e411c93ee5c,completed maintenance checks,completed preventive maintenance inspections,general,technical,,2026-02-15 17:47:32.616746+00
bae671e4-b85b-4a19-a91d-bcb288bae24e,pinned Chief,promoted to senior management level,navy,admin,,2026-02-15 17:48:35.249974+00
bb55499c-bfce-4cdc-8b38-8b28eaa712cb,briefed general officers,presented to C-suite executives,army,communication,,2026-02-15 17:47:32.616746+00
bbae6811-d3d8-487c-b0a5-9bf0dc313b2d,muster,accountability formation or roll call,navy,Admin,,2026-02-18 14:03:12.64537+00
bbc603e2-5556-4289-b653-31ffb219105d,medical evacuation operations,emergency patient transport / air ambulance operations,general,medical,,2026-02-18 01:13:54.18454+00
bc488654-5161-49e6-9e56-ff14e0205b5e,stood up the JOC,established the joint operations center,general,Operations,,2026-02-18 14:03:12.64537+00
bc50f505-490b-4381-b167-2bdff478e225,stood EOOW watches,supervised 24/7 engineering plant operations as shift supervisor,navy,operations,,2026-02-15 17:47:32.616746+00
bc58bfc3-a2b8-4f7c-9b0a-2473f355deae,built unit cohesion,strengthened team collaboration and morale,general,Leadership,,2026-02-18 14:03:12.64537+00
bc5cd7e2-e78f-498d-ad9f-c9b836360a42,non-judicial punishment,administrative disciplinary action,general,Admin,,2026-02-18 14:03:12.64537+00
bc6b6029-87e2-4a87-9d42-ca735cf1e2fe,all-hands call,organization-wide town hall meeting,general,Communication,,2026-02-18 14:03:12.64537+00
bca61121-ee2d-458b-86d6-3959bc065fb9,served as senior enlisted advisor,served as senior workforce advisor,general,Leadership,,2026-02-18 14:03:12.64537+00
bca9645f-dc9b-473f-84ab-dcc3910ab50e,developed lesson plans,created training curriculum / designed course materials,general,training,,2026-02-18 01:13:54.18454+00
bccb5ba3-1ae5-4d7d-9759-a75721d0668f,served as superintendent,served as senior operations superintendent,usaf,leadership,,2026-02-15 17:48:35.249974+00
bd0d1cce-3f49-4d89-9a97-03921fb9e091,served as scene leader,served as on-scene incident commander,navy,operations,,2026-02-15 17:48:35.249974+00
bd667810-a0c3-436e-9644-d83d8dd0cc68,produced intelligence estimates,produced analytical forecasts / risk assessments,general,intel,,2026-02-18 01:13:54.18454+00
bd96b9cc-3ec2-4e2d-b215-276ef901aa0d,command ombudsman,employee liaison and family support coordinator,navy,Admin,,2026-02-18 14:03:12.64537+00
bdb3c41e-dec2-493c-bd07-ce3f0102c45c,no discrepancies noted,clean audit results with no findings,general,compliance,,2026-02-15 17:47:32.616746+00
bdc8963d-ce6f-4645-86c4-c4a22c74a227,surface warfare qualified,earned surface operations professional certification,navy,Training,,2026-02-18 14:03:12.64537+00
bdeebe5e-041e-4de9-99c7-2c0eda687aff,budget execution,budget management and expenditure tracking,general,financial,,2026-02-18 01:13:54.18454+00
be01492c-66e9-4484-8981-b4b9f464b622,maintained satellite communications,managed satellite-based communications systems,general,comms,,2026-02-18 01:13:54.18454+00
be0f8e5f-a663-4a70-bc8d-28a742d4aec9,signed off,certified and approved,general,Training,,2026-02-18 14:03:12.64537+00
be435a58-c8d8-4734-b497-82b45896d867,FMC,fully mission capable or fully operational,general,Equipment,,2026-02-18 14:03:12.64537+00
be674784-7dea-4fca-8157-186ae6359d24,served as at-sea fire party member,served as emergency fire response team member,navy,operations,,2026-02-15 17:48:35.249974+00
bebadee6-4366-4824-b045-109bd0339756,Class IX supplies,repair parts and components,general,Equipment,,2026-02-18 14:03:12.64537+00
bef2d981-65d9-4d36-88a8-ea924f507ae1,signed PQS for,certified personnel qualification completion for,navy,training,,2026-02-15 17:48:35.249974+00
bf411a5a-3ab2-45d2-a572-2b23f75da4af,cross-trained,trained across multiple disciplines,general,Training,,2026-02-18 14:03:12.64537+00
bf48b3e0-97ee-4e84-927e-dc68eeb51874,fit for duty,cleared for full work duties,general,Medical,,2026-02-18 14:03:12.64537+00
bf530b86-4e58-403d-aeec-ef2a4c6e6f13,submitted SITREP,submitted status report to leadership,general,communication,,2026-02-15 17:47:32.616746+00
bf7c124d-0351-4c8f-9274-54e56f4d2309,command and control,management oversight and coordination,general,leadership,,2026-02-18 01:13:54.18454+00
bf7c41d8-5e65-4c0b-91eb-3c233ae13e86,explosive safety,explosive and ordnance safety protocols,general,Safety,,2026-02-18 14:03:12.64537+00
bfb66192-7a01-4aab-9443-82ca1e2f7e70,hand receipt,signed equipment custody document,army,Equipment,,2026-02-18 14:03:12.64537+00
bfee34fa-3050-49a9-b1bc-d970234ccc90,established battle rhythm,established recurring operational cadence,general,leadership,,2026-02-18 01:13:54.18454+00
bff10c62-137a-475c-adfd-93ec313d4caa,read ahead,pre-meeting briefing materials,general,Communication,,2026-02-18 14:03:12.64537+00
c005828d-74dc-4e74-a79b-ea1f9c2de474,confined space entry,confined space entry safety procedure,general,Safety,,2026-02-18 14:03:12.64537+00
c00ab730-6eb8-4f87-9830-6a7e66303fcf,triage operations,emergency patient prioritization / triage management,general,medical,,2026-02-18 01:13:54.18454+00
c019ead3-91a8-4439-9983-ed92a962d942,zero deficiencies,zero audit findings/deficiencies,general,compliance,,2026-02-15 17:47:32.616746+00
c0331814-7a51-4bbe-a15c-ac61b7cd6c04,service record,official personnel file,general,Admin,,2026-02-18 14:03:12.64537+00
c07493f3-94cb-459a-b282-f9251260e507,mishap free,zero workplace incidents,general,safety,,2026-02-15 17:47:32.616746+00
c0927c20-e47d-4d92-8856-e2afc67e1bc2,SITREP,situation report or status update,general,Communication,,2026-02-18 14:03:12.64537+00
c0acf749-71e0-4916-a281-cd53f798ddae,mission debrief,after-action review meeting,general,Operations,,2026-02-18 14:03:12.64537+00
c0b7866b-76a1-4882-89e7-d1d2c7bb969b,exceeds standards,consistently surpasses performance benchmarks,general,performance,,2026-02-15 17:48:35.249974+00
c0c2f247-c819-4597-8955-e547de552f37,left seat right seat ride,supervised transition period with predecessor,army,Operations,,2026-02-18 14:03:12.64537+00
c20c83b8-3f53-4be9-b0fd-d94406af9da7,ran a tight ship,maintained high operational standards,general,Leadership,,2026-02-18 14:03:12.64537+00
c235ec0b-fe2c-4ef1-b4e8-3eb18db9964a,served as CPO mess president,served as senior management council president,navy,leadership,,2026-02-15 17:48:35.249974+00
c23f703f-6561-4e36-9a08-cecfcb09d070,equipment serviceability rate,equipment availability / asset uptime rate,general,logistics,,2026-02-18 01:13:54.18454+00
c2ab0a62-55da-46f2-aab8-0254339e6046,maintained AF Form 623,maintained individual training records,usaf,admin,,2026-02-15 17:48:35.249974+00
c331e70f-f696-4b4d-aef9-c47516f20409,vulnerability assessment,security vulnerability assessment / penetration testing,general,cyber,,2026-02-18 01:13:54.18454+00
c3346231-bef9-4cdd-b91f-309405a7a3b7,theater of operations,operational region / area of business operations,general,operations,,2026-02-18 01:13:54.18454+00
c36e0106-3348-4f9f-9c4c-2f4edd47d18a,preflight inspection,pre-operation safety inspection / equipment check,general,aviation,,2026-02-18 01:13:54.18454+00
c3801234-5c3c-48ee-91ad-000c5a571446,mission planning,project planning and preparation,general,Operations,,2026-02-18 14:03:12.64537+00
c38578fa-4be6-478e-a578-6eaea4993bfa,a consummate professional,a consummate professional,general,performance,,2026-02-15 17:48:35.249974+00
c3898ed5-c85c-4e3d-8e6e-a84269d22e95,selected as Blue Jacket of the Year,selected as top entry-level employee of the year,navy,performance,,2026-02-15 17:48:35.249974+00
c45695c6-a8a3-4b5c-9f9e-ef7319193b10,must promote,highest recommendation for immediate promotion,general,performance,,2026-02-15 17:48:35.249974+00
c519fe48-1581-4cba-8f89-1522feb1e1d0,copy,message received and understood,general,Communication,,2026-02-18 14:03:12.64537+00
c52468ac-fb7d-46f1-a101-ac2355e7977a,PPE compliance,personal protective equipment compliance,general,Safety,,2026-02-18 14:03:12.64537+00
c536c039-151d-4842-8a01-126b63892258,FLIPL,financial liability investigation for lost property,army,Equipment,,2026-02-18 14:03:12.64537+00
c54a9e6e-195b-4e40-98e0-06deca2c5494,fiscal year planning,annual budget planning / fiscal year forecasting,general,financial,,2026-02-18 01:13:54.18454+00
c55de95c-caa8-4965-b9ed-038931f4ddc0,delivered results under pressure,produced outcomes in demanding conditions,general,performance,,2026-02-18 01:13:54.18454+00
c57f2891-0474-462c-954a-a2a22babe84a,conducted ship-to-shore movement,coordinated complex personnel and equipment transfer operations,usmc,operations,,2026-02-15 17:48:35.249974+00
c5844f81-a305-4a16-81c0-fe34b4801487,earned Enlisted Surface Warfare Specialist,earned advanced surface operations qualification,navy,training,,2026-02-15 17:48:35.249974+00
c59d4ac8-0ceb-425d-b191-27f2c7feb760,forward deployed,assigned to remote operations,navy,operations,,2026-02-15 17:47:32.616746+00
c5bd74b0-86ac-4a3a-b0ca-2b662f679957,special request chit,formal request form,navy,Admin,,2026-02-18 14:03:12.64537+00
c5e59d46-5067-4110-a6a3-fce57c981f7f,anti-piracy operations,maritime law enforcement operations,navy,operations,,2026-02-15 17:48:35.249974+00
c67a573e-28c1-4c1d-9c70-1f9408082d24,served as acting commander,served as interim director / acting manager,general,leadership,,2026-02-18 01:13:54.18454+00
c6dab09b-6b3f-4f0c-8fc3-c1d8d06d61ee,stand by,please wait for further information,general,Communication,,2026-02-18 14:03:12.64537+00
c71685f3-cbf7-4e52-a332-ef28ee15cee0,ahead of schedule,completed ahead of schedule,general,performance,,2026-02-15 17:47:32.616746+00
c73f0c3a-d4e9-48cb-9ea4-1a7629c896ae,COMSEC material,encrypted communications material,general,security,,2026-02-15 17:47:32.616746+00
c7d3759e-e109-49b4-8dcb-7c86433d26d6,imagery intelligence,satellite and aerial imagery analysis,general,intel,,2026-02-18 01:13:54.18454+00
c7e98571-42b7-4a15-9b1a-92daf1666bb0,brought online,successfully launched,general,Performance,,2026-02-18 14:03:12.64537+00
c7ee3baf-0bf5-4c66-9421-dff214fd715f,served as CMEO,served as equal opportunity program manager,navy,admin,,2026-02-15 17:48:35.249974+00
c7facc79-7370-41a0-9949-9eed8783da74,FPCON,security alert level,general,Operations,,2026-02-18 14:03:12.64537+00
c8d42258-148e-4a81-9dd7-ae94682b2b87,steady state,normal operations,general,Operations,,2026-02-18 14:03:12.64537+00
c8fb5124-4a6a-4e48-b71e-c7bff57721b3,SNCO academy graduate,completed senior leadership development program,general,Training,,2026-02-18 14:03:12.64537+00
c99a4ed4-fa30-42c6-a0dc-247b84f12eb0,hazard identification,workplace hazard identification,general,safety,,2026-02-15 17:47:32.616746+00
c9e5c143-f505-44aa-911f-4eeadfa77441,#1 of all E-7s,ranked #1 among all senior managers,navy,performance,,2026-02-15 17:48:35.249974+00
ca3b22d3-e4da-452e-90a0-9bc6b053c79c,up and running,fully operational,general,Performance,,2026-02-18 14:03:12.64537+00
ca3b296f-977a-41c5-b5b4-5dfe0575c9b0,contingency operations,emergency response operations / crisis management,general,operations,,2026-02-18 01:13:54.18454+00
caa5ece9-ed08-4827-aa34-89141766af67,served as PME instructor,served as professional development instructor,usmc,training,,2026-02-15 17:48:35.249974+00
caeef8a6-b2f9-4dec-8dcb-e80fc21b988a,earned Expert Infantry Badge,earned advanced infantry proficiency certification,army,training,,2026-02-15 17:48:35.249974+00
cb2e2d2d-9ee7-469d-8ac8-09d320deb35f,up the chain,escalated to higher management,general,Communication,,2026-02-18 14:03:12.64537+00
cb979fce-8ca9-41e0-b004-503e80214dde,indoc,new employee orientation program,general,Admin,,2026-02-18 14:03:12.64537+00
cb97e0a1-2ffd-4df1-80ac-40203284511c,raised the bar,set new performance standards,general,performance,,2026-02-18 01:13:54.18454+00
cbd1855c-0b16-425b-b20d-00a5fcf51c35,patrol base operations,forward operating base activities / remote site operations,general,operations,,2026-02-18 01:13:54.18454+00
cbe583d1-44a5-4a91-8d77-165a1b95f654,held feet to the fire,enforced accountability for deliverables,general,Leadership,,2026-02-18 14:03:12.64537+00
cc18b55e-0815-4269-8a3d-be42ace26cce,enforced standards,enforced organizational standards and policies,general,leadership,,2026-02-15 17:48:35.249974+00
cc3dfb81-2ecf-4c03-b11a-6e0a67d5c5c4,stability operations,stabilization and support activities,general,operations,,2026-02-18 01:13:54.18454+00
ccab1938-477f-4fdf-9395-7be388171e93,class B mishap,severity level 2 incident with significant damage,general,Safety,,2026-02-18 14:03:12.64537+00
ccf9bef9-279d-4923-95f3-864196663fdc,threat assessment,risk assessment / threat analysis,general,intel,,2026-02-18 01:13:54.18454+00
ccfa6585-af1c-4a13-8956-bba067d440a9,counter-terrorism operations,counter-terrorism and force protection operations,general,operations,,2026-02-15 17:48:35.249974+00
cd8d84e3-d347-45d3-94e0-7faa1d835794,THA,tool hazard analysis,general,Safety,,2026-02-18 14:03:12.64537+00
cd8eda69-a3c9-4f9b-a664-bf5a8b4b02ac,depot-level maintenance,factory-level overhaul / major equipment repair,general,logistics,,2026-02-18 01:13:54.18454+00
ce5d8871-4d20-477e-9044-6472a0744af3,organizational-level maintenance,routine maintenance performed by operating unit,general,Equipment,,2026-02-18 14:03:12.64537+00
ce83c1cb-3e23-45e7-a1dd-60c46b0f8776,earned Airman of the Quarter,selected as employee of the quarter,usaf,performance,,2026-02-15 17:48:35.249974+00
ce86c277-55fd-4b68-81f6-fa19f3a03975,tag out,lockout/tagout safety procedure,navy,Safety,,2026-02-18 14:03:12.64537+00
cef8b9a7-1b20-46fe-a138-54eda13dbfa5,knocked it out of the park,far exceeded expectations,general,Performance,,2026-02-18 14:03:12.64537+00
cefb4aa6-d445-402c-9615-f1e87dba6244,noncombatant evacuation,civilian evacuation operations,general,operations,,2026-02-15 17:48:35.249974+00
cf4c1119-b27b-490b-8aae-4a5550537b52,served as battalion sergeant major,served as senior enlisted executive advisor for 800+ personnel,usmc,leadership,,2026-02-15 17:48:35.249974+00
cf6c26d1-d200-45bd-9895-65cae93025c1,principal advisor to the commander,chief advisor to the executive director,general,Leadership,,2026-02-18 14:03:12.64537+00
cfc0934e-8296-48b9-abb4-9988ae8491ce,human intelligence,human source information gathering / interview-based research,general,intel,,2026-02-18 01:13:54.18454+00
cfd52aa7-44a1-4e22-93da-6261b539e423,combat stress control,crisis counseling / behavioral health support,general,medical,,2026-02-18 01:13:54.18454+00
cfeaa8b6-31d8-484c-b527-ae4eaa9f0c4a,marine of the quarter,employee of the quarter,usmc,Leadership,,2026-02-18 14:03:12.64537+00
cff7f3fd-ef1f-4c5a-8af3-8b6be8d2de28,established communications architecture,designed and deployed network infrastructure,general,comms,,2026-02-18 01:13:54.18454+00
cff9f929-7589-4709-884d-8119fdfa9ac0,supply discipline,inventory control / asset accountability,general,logistics,,2026-02-18 01:13:54.18454+00
d02fd227-b31a-47ad-b305-84f75e6b1a6e,fund execution rate,budget utilization rate / spend rate,general,financial,,2026-02-18 01:13:54.18454+00
d036c7a0-d350-44c6-8faa-bb04411d402f,conducted AAR,led post-project lessons learned review,general,communication,,2026-02-15 17:47:32.616746+00
d1134ef0-37ad-48f7-93b4-5b3cc05229e0,stood watch,supervised operational shift,navy,operations,,2026-02-15 17:47:32.616746+00
d130f0eb-d275-4478-a3b9-0f08f59f6521,passed LOE,passed engineering systems readiness examination,navy,compliance,,2026-02-15 17:48:35.249974+00
d130fd49-fdc7-4190-ad73-059fd2b5c1e6,served as CO,served as commanding officer/chief executive,navy,leadership,,2026-02-15 17:47:32.616746+00
d1bccfbd-2326-4e74-a18c-1273a3504681,CPO Mess,Senior Leadership Team,navy,leadership,,2026-02-17 04:35:18.795826+00
d1bd09f4-3396-403d-8940-0256bb61b3b8,FMF qualified,earned Fleet Marine Force qualification,navy,Training,,2026-02-18 14:03:12.64537+00
d1fdc67f-aea8-49b6-84c1-11b98bb3e5c9,conducted training,developed and delivered training,general,training,,2026-02-15 17:47:32.616746+00
d20a14e1-0a19-4ca4-babf-33400794eb11,in-processing procedures,employee onboarding procedures,general,admin,,2026-02-18 01:13:54.18454+00
d267d2a7-09d3-497f-94ed-ffdd4f74ac33,roger that,understood and acknowledged,general,Communication,,2026-02-18 14:03:12.64537+00
d29ead68-ffb9-4198-a890-a6d36845fcbf,100% mission completion,achieved a 100% task completion rate,general,Performance,,2026-02-18 14:03:12.64537+00
d2b2a1e3-9051-4ed5-a78d-3e22d033b244,material inspection,equipment condition assessment,navy,compliance,,2026-02-15 17:47:32.616746+00
d2bd31d8-c01e-4bfd-905d-690a90c102a5,fall protection,fall prevention and safety system,general,Safety,,2026-02-18 14:03:12.64537+00
d360975b-5cab-4239-bfc4-c0d6f7b0a098,set the standard,established the performance benchmark,general,Performance,,2026-02-18 14:03:12.64537+00
d381d5b8-1f75-4739-8eba-d175a0ff2f70,huddle up,quick team meeting,general,Communication,,2026-02-18 14:03:12.64537+00
d426f0da-4267-4c2e-b606-b1d229ef3d63,CBRN drill,"chemical, biological, radiological, nuclear response drill",general,Safety,,2026-02-18 14:03:12.64537+00
d44fe8d8-6f9c-46ae-b284-dd5079d1a461,from the ground up,from initial concept to completion,general,Performance,,2026-02-18 14:03:12.64537+00
d4aefd91-5e5d-4202-8707-9bbecc231506,career counselor,employee career advisor,general,Admin,,2026-02-18 14:03:12.64537+00
d4c544f6-8611-409f-9521-b62074a0aacd,selected as Sailor of the Quarter,selected as employee of the quarter,navy,performance,,2026-02-15 17:48:35.249974+00
d4dd70d3-6ec1-4820-ab80-c5d9ee255648,served as platoon sergeant,served as senior operations supervisor for 40+ personnel,usmc,leadership,,2026-02-15 17:48:35.249974+00
d51b90b8-75ba-424a-8609-854b0a403929,maximum effort,full commitment to achieving results,general,Performance,,2026-02-18 14:03:12.64537+00
d52776d5-0bb3-4e51-9104-d0910141fdd8,firemain system,facility fire water distribution system,navy,technical,,2026-02-15 17:48:35.249974+00
d55e9d7d-7f23-41d1-b13f-95299b7145c1,urinalysis coordinator,workplace drug testing program coordinator,general,Admin,,2026-02-18 14:03:12.64537+00
d58e7533-5f24-4ad5-bd99-a29acb29f131,qualified in rate,earned professional certification in specialty,general,training,,2026-02-18 01:13:54.18454+00
d5b708f3-0a83-4720-a735-ef7bc49bdc2f,unfunded requirement,budget shortfall for required item,general,Equipment,,2026-02-18 14:03:12.64537+00
d5bbd96a-c759-4222-a115-b2aca7f56b49,earned the trust and confidence of,earned the full confidence of senior leadership,general,performance,,2026-02-18 01:13:54.18454+00
d60171a8-4adf-48b0-9f85-d2b827c519f9,flag it,highlight for leadership attention,general,Communication,,2026-02-18 14:03:12.64537+00
d65b5d84-3b7a-439c-bb91-c5f6541cd2ba,received Defense Meritorious Service Medal,received defense-level executive achievement award,general,admin,,2026-02-15 17:48:35.249974+00
d69e7b63-7ea4-4468-ab24-33a81455e10f,master training specialist,certified master instructor / lead training facilitator,general,training,,2026-02-18 01:13:54.18454+00
d6c9646b-a8a1-4ab4-8350-eaa0d7b7f39c,tech school graduate,completed technical skills training,usaf,Training,,2026-02-18 14:03:12.64537+00
d72d253c-9d6b-49a3-9583-26616ecc2381,directed multi-echelon operations,managed multi-level organizational operations,general,leadership,,2026-02-18 01:13:54.18454+00
d79d5687-1a4c-4369-9523-60dcf5e21ea3,accountability report,personnel status and location report,general,Operations,,2026-02-18 14:03:12.64537+00
d7c38e79-9dfd-4aaf-a87c-a7bbdcb1b4fd,backbone of the unit,essential to organizational success,general,Leadership,,2026-02-18 14:03:12.64537+00
d7f1f34a-3941-4f35-8ff5-add094159cc0,be advised,please note the following information,general,Communication,,2026-02-18 14:03:12.64537+00
